<?xml version="1.0" encoding="UTF-8"?>
<xs:schema xmlns:xs="http://www.w3.org/2001/XMLSchema" elementFormDefault="qualified">

    <xs:element name="QLMH">
        <xs:complexType>
            <xs:sequence>
                <xs:element name="MonHoc" maxOccurs="unbounded">
                    <xs:complexType>
                        <xs:sequence>
                            <xs:element name="MaMH" type="xs:string"/>
                            <xs:element name="tenMH" type="xs:string"/>
                            <xs:element name="soGio">
                                <xs:simpleType >
                                    <xs:restriction base="xs:int">
                                        <xs:minExclusive value="4"></xs:minExclusive>
                                        <xs:maxExclusive value="48"></xs:maxExclusive>
                                    </xs:restriction>
                                </xs:simpleType>
                            </xs:element>
                        </xs:sequence>
                    </xs:complexType>
                </xs:element>
            </xs:sequence>
        </xs:complexType>
        <xs:key name="mhKey">
            <xs:selector xpath="MonHoc"/>
            <xs:field xpath="MaMH"/>
        </xs:key>
    </xs:element>
</xs:schema>
